SKELETON COURTIER|In the depths of the Heart, the ancient burial mound of an unnamed King sits beneath a tree. He lives out his afterlife here in a sort of skeletal heaven, completely off his head on narcotic tree sap drunk from the roots above him. His court, a selection of similarly dead weirdos and lackeys, fightoveraccesstotheintoxicatingsapinaneffort to put up with his interminably long war stories.|Ser Ethelren, Ser Fenswith, Lady Arablast.|Absolutely loaded on intoxicating tree sap and having problems holding it together; Bearing the crest of one of the noble houses of the City Above; Has arms and legs tied on with twine.|To hear interesting stories and brutallymurderanyonewhotriestostealtheirsap.|Standard|12|0 to 2, depending on whether they were buried in diaphanous gowns or ancient platemail.|Tarnished but beautiful burial goods (D8).|Ancient and rusted weaponry (D8, Unreliable)|Their bony bodies lower stress dice from edgedweaponsandbulletsby1step,butincrease the stress dice from blunt weapons by 1 step.|Warren
SOURCEBORN CONSTRUCT|These blurring storms of noise and steel are the guardians of the Source. On occasion one might creep out in search of supplies (rare metals or silicates), but it’s almost unheard of for one to leave their heavenly circuit.|None in a language that you can understand or speak|A flickering blur of steel and carbon dust that forms itself into hexagons; A box which appears motionless until razor- sharp filaments spiral forth to maim you; A hovering obsidian orb that telekinetically flings objects around it with terrifying precision.|To protect and repair the mysterious sigils on the walls of the Source.|Risky|20|2|Machine heart (D12, Technology); Impossibly keen metal to make sword-blades from (D8, Technology).|Ultrasharp metal shards (D6, Brutal, Piercing, Ranged. When used by another, they gain the Dangerous tag).||Technology
THE BLIGHTED|There is a parasite that gives trees the gift of awakening and curses them to insanity. Burrowing and festering deep within the wood,the parasite changes the tree’s biology to allow it to move on creaking dirt-caked legs of root and bark.They can think as quickly as the short-lived creatures that flit around it in the forests of their home. But the parasite is hungry, and eats the wood of the tree in which it lives. Specimens have rents in theirbarklinedwithwrithingfleshygrowthswhere they’ve been ravaged by it. The tree feels this sensation as an irritation at first, but as the parasite grows in power and mass,it builds to a overwhelming,unscratchable itch that drives the tree insane. The only way of stopping the itch is to give the parasite something else to eat, and even then, it is only temporary. Plant matter doesn’t work fast enough and the trees don’t want to risk further infection, so they hunt and kill other creatures, pressing the corpses against their festering wounds to calm the ravening sensation a little. Those that have been infected the longest lope through the forests with their kills impaled on their upper branches, occasionally pausing to tear off a rotting limb and hold it against themselves as they visibly relax. If the trees don’t consume their kills immediately, they gain some measure of control over the flesh via the parasite. Hands can grasp and manipulate; horrifically, faces can speak in the voices of their original owners. A blighted who’s managed to learn to speak through a stolen mouth is rare, and acts as a caretaker for other, less fortunate infected trees. If the blighted weren’t all insane, they might be able to form a culture and somehow communicate with the other inhabitants of the Heart; in the moments when their minds calm down enough, they sometimes realise the horror of what they’re doing. But the clarity doesn’t last for long, and it brings a guilt that’s as bad as the itch itself.|They don’t have, or really understand, names. Things are marked by their geographic location rather than a distinct moniker; where you are is what you are.|Carrying a twitching deer in its upper branches, letting the blood spill down over its wounds; Desperately trying to stand still amidst a copse of trees in ambush; Cradling a corpse to their “chest” as the parasite consumes it.|To get the itching to stop.|Standard|10|4 versus weapons that can’t chop down trees.|Parasite samples (D8, Cursed, Dangerous); Assorted equipment and bones from its kills (D6, Haven, Wild).|Impaling branches (D8).|Fire inflicts double stress when used against the Blighted.|Wild
THE CARNIVAL|The Carnival is eternal. Sometimes the dancers die – their feet battered and bloody, crawling through abandoned districts on hands and knees – but the Carnival itself endures. The Carnival is a brain-wyrm that makes sufferers dance, cavort and sing. It is a gift, a cruel reward, sung into the minds of the undercity by a misguided warrior- poet of the aelfir in the City Above. It is greater than the sufferers. Those who can write will scratch the words of it into walls, a word- salad nonsense that infects the reader. It hides in thechorusesoffolksongs,inthesingsonggamesof children,in the graffiti on gang territory.Occasionally infection will come to a head and an entire haven will take leave of their senses, drape themselves in colourful rags and skip through the Heart, singing the virus aloud to bewitch and lure in passers-by. There’s nothing malicious about them; honestly, even though they’re malnourished and their feet are ruined with blisters, they seem genuinely happy.There are far worse ways to die down here. The Carnival is not the only brain-wyrm to enter the Heart. Mummer-Pox causes sufferers to act out a great aelfir play that can only be performed over millennia, and this was deemed to be the most effective method of staging it. The Labyrinth Curse compels the infected to construct complex mazes riddled with traps around things it deems “unsafe.” Scrivener’s Lament forces those that carry it to write book after book, all attributed to the same author.|Gregor, Yolande, Klimpt|Shaking a noise-maker made out of pebbles in a glass bottle; Carrying a severely malnourished (but uninfected) infant on their back; Daubing a shaky mural depicting the carnival onto the wall nearby in white paint.|To dance! Occasionally they’ll come to their senses and scream in pain and hunger, so many troupes include a drummer among their number to keep the rhythm going.|Standard|4|0|Whatever they were carrying when the infection took hold (D4)|Mostcarrybreakablenoise-makers (D6, One-Shot) or are unarmed; none of them are really interested in fighting, though.|Hearing the song of the carnival triggers an Endure+Occult check with D6 stress to Mind on a failure; getting up close (say, if you were rescuing someone) increases the stress to D8. You can overcome this by plugging your ears with wax or something similar, but this brings its own complications.|Haven, Desolate.
THE CULT OF KNIVES|There is a room where the knives that long for blood go. Ifadagger isusedin enough murders,it’llgeta taste for it.It will nudge and tweak the hand of its owner, begging to be plunged back into warm wet flesh and feel the shuaddering of a last breath. For a knife, a murder is heaven – an ecstatic joy, a sharp and sudden power, a sense of purpose fulfilled. Knives who kill enough people start to realise that it is they, the “tools,” that hold the power – not the people who carry them. They begin their own crusades against those they hate, often changing hands several times throughout a string of murders. Even though they are incapable of moving under their own power,they will warp the minds of those that hold them and call out to others of the same kind. They will begin to plot; they will form a cult. ThisishowyouwillmeettheCultofKnives:inan unassumingbasementorattic,whilstsearchingfor something long thought lost, you will find a wide- eyed man or woman who has apparently stabbed themselves with thirteen or so knives and left them lodged inside their body. They are rendered senseless from the power of the knives.Within them,the cult of knives commune and whisper in a silent language of steel and blood and sharpness. As they notice you,they pluck one of the congregation from their thigh and lurch towards you,trailing blood,in an attempt to silence you. The following stats are for the current “bearer” of the congregation – the knives are unable to move or attack under their own power.|If you remove every knife,they’ll come to their senses and tell you their name (Theodora, Clovin, Wyst) before dying of blood loss.|Wearing bedraggled fancy clothing, like they walked here from the City Above; Calmly rearranging the knives in their torso as different cultists hold the floor; Coiled and ready to strike, assassin-like, eyes scanning the entrances.|To stop any interruptions to the meeting.|Risky|12|0|Barely anything, although you might be able to sell the knives.|Upwards of 13 knives (D6, Spread), all of which have been used in multiple killings and are, in a way, intelligent.|TheCultofKnivesignoresallProtection.|Desolate, Warren, Haven.
THE WALKING WOUNDED|Years ago – maybe even a century – the 33rd Regiment of the Allied Defence Force were sent into the City Below to pacify the Heart. Some of them went AWOL and would go on to form the Hounds as they are today; most weren’t that lucky. You hear tell of what happened as you work your way down a bottle of rotgut liquor and huddle around the trashfires for warmth. They are horror stories even for denizens of the Heart: legends of unimaginable cruelty on the part of the 33rd’s mad aelfir officers, themselves protected by shimmering wards and implanted saints’ bones, marching at the head of columns of deranged and mind-blasted soldiers. You hear whispers of doomed assaults on heartsblood enclaves and encroaching angels; of the walls of the City Beneath coming alive and crushing – chewing – the poor bastards to pulp; of the flesh and bone of the troopers coming untethered and rewriting itself in hideous new shapes. The worst thing, they say, is that the least fortunate of all never died. They can’t. In their final moments of torment and confusion and panic, they bonded with the eternal energy of the Heart.|You’ll see them at the edge of a haven: rendered senseless, bandages over ruined eyes, hands on each others’ shoulders, limping in a line to Goddess knows where. If you’re brave enough to approach them, you’ll realise that they aren’t a line of soldiers – they’re all one mass of flesh, hand- stumps fused to shoulders, ancient iron pistols melded with puckered skin and twisting bone. Some are still following their original mission: to dig trenches, repel invaders or take enemy positions and slaughter everyone inside. Most are just trying, blind and broken, to get home.|Somewhere in the depths of their minds they still remember their names, but their mouths are too twisted to pronounce them.|Medals fused into chest; Bandages made of crumbling skin covering their sores; Dragging a heavy jezail that’s melded with their arms.|To get home, which is a hopeless endeavour,becauseeveryonetheyknowdieddecades ago. Many believe they’re still at war with whoever they meet,but you might be able to convince them otherwise. Some, accompanied by their insane and undying aelfir officers, are still attemptingtofulfiltheiroriginalmissions.|Standard – they can’t see or hear properly, but they can sense movement uncannily well.|4 for each “surviving” member of the squad; most have around resistance 20.|2|Nothing of value.|Jagged bone spurs and knives (D6); Rusted archaic firearms (D8, Ranged). Items removed from the walking wounded corrode completely within minutes, making them unusable by others.|Cursed, Desolate.
TUNNEL BRIGANDS|Opportunistic thieves and killers who prey on vulnerable travellers for their valuables are most commonly found in the tunnels to the Home Nations, but there are no end of places where a gang of desperate people with guns and a lack of empathy can makeaquickbuck.They’renotupforaseriousfight, and are generally open to bargaining if you have somethingtoofferthattheycan’tjusttakefromyou.|Jonjak, Pentekost, Mataline|Wearing stolen Yssian fashion, taken from refugees; Younger than they really oughttobeforthislineofwork;Chestboundtight withbandages,bracesholdinguptheirtrousers.|To take money or valuables from folk using the tunnels to emigrate into the City Above; however, they’re boisterous and insecure,so some will take any opportunity to prove their cruelty and superiority.|Standard|5|1|Wedding rings, gold teeth, family heirlooms, silk scarves (D8, Taboo); a few doses of dagger, godsmoke or chum (D6, narcotic).|Heavy-bore archaic pistol (D8, Brutal, Ranged, Loud, One-Shot), Wicked-looking knives (D6, Brutal).||Warren, but Brigands can be found anywhere there are travellers.
WRETCH|The Tunnels of Wet Filth are home to some of the most wretched and disgusting creatures that the Heart has to offer. A lot of the inhabitants keep them as pets, and an enthusiastic breeding/ surgery program has ensured a wide variety of absolutely horrible monstrosities.|Gronk, Chrysanth, Felice.|It was once four dogs, but now it’s melded together; A crocodilian shadow, barely seen; A snorting, finned piglike creature with a horrible wide mouth.|To eat delicious legs poked under the surface of the filth, or to perform “tricks” (usually eating delicious legs) for their masters in exchange for treats (further delicious legs).||6|2 when they’re under the surface, but 0 if you can get them onto dry-ish land.|The creatures and the garbage they swim around in are useless outside of the tunnels, but inside it they’re praised with a reverence that makes them (D6, Religion) items.|Dirty teeth and claws (D6, Degenerating);Retchingbile(D6,markstresstoSupplies).||Warren