GNOLL INCURSION TEAM|The Heart is of particular interest to occultists, theologists and fringe scientists from all over the world. Some of them even manage to reach and explore it within their lifetimes rather than just reading about it in books. As the gnolls who dwell in the deserts to the south are officially at war with the rulers of the City Above, the only way they can get their demonomechanical experts inside the City Beneath is to sneak in and hope they don’t get caught. Wearing special suits of sandwalker leather designed to withstand the wild energy of the Heart, teams of between six and ten gnolls explore the strangeness around them and document it on curious devices: shimmering spheres, light as soap-bubbles but strong as iron, that they say contain bound djinn of remembrance. Most of the inhabitants of the Heart let them get on with it, since they keep themselves to themselves for the most part. But each new moon, there is a standing bounty paid for the heads of gnolls delivered to the Derelictus central square each, which is doled out by serious-looking drow administrants from the City Above. The exploration teams do their best to keep their existence a secret and to silence anyone who might report them to the authorities. NAME: Doctor Pitchwood, First Assistant Sareth, Protector Bahram.|A blue-white searchlight stabbing through the darkness, illuminating you but leaving them in shadow; Screwing bulky lenses into place on their visor to observe a heartsblood creature; Tracing circuit- board patterns in blood around a humming battery to recharge it; Reinforcing subdermal shielding and limbic wards.|To catalogue the weirdness of the Heart and send back data to Al’Marah; to evade detection.|Standard. One gnoll per party is designated Protector and is Risky instead|Standard. One gnoll per party is designated Protector and is Risky instead|5|2|Arcanotechnological detritus, none of which you understand (D10, Technology, Occult, Dangerous).|Gilded shotcannon (D8, Point- blank, Reload, Expensive) or Prey-Hook (D6, Debilitating, Ranged); Arcanochemical bombs (D6, Ranged, Spread, One-Shot).||Technology.
GODBEAST|The Forest is an ancient heaven that slumbers beneath the earth waiting for the cities of the world to fall. Through it stalk creatures unlike any of those seen in the surface world: great elk, ten foot high at the shoulder with horns of stone and crystal; boars with tusks the size of a drow’s arm and muscles like steel hawsers; and monstrous dragonflies that buzz through the air with a low bass drone. On occasion, when a great hunter dies and their soul awakens in the Forest, the path between the ancient hunting ground and the real world opens, and godbeasts will step out in search of new food sources. Briar is the most common place to find them, but not more than once a decade does a hunter of sufficiently legendary proficiency pass away.|None that you would understand.|Crashing through a treeline; Viciously protecting its young, themselves the sizeofafully-armoureddrow;Fleeingthearrival of something even larger and more dangerous.|To protect its young, which may or may not be on the same plane of reality as them.|Standard. Once below resistance 10, their difficulty increases to Risky.|30|3|Pelt (D10, Religion, Wild. Counts as a Mend Blood D6, Block item when worn).|Trampling hooves or gnashing teeth (D8, Brutal).||Wild
GREATER HEARTSBLOOD BEAST|These were animals once, but the energies of the Heart and generations of breeding have changed them into something protean and terrible. The smallest are the size of mice (they can shift their bodies into insubstantial shadowstuff, making them nearly impossible to hunt), but those that will pose a threat to delvers tend to be the size of stray dogs, feral pigs, or scavenging foxes. The Heart has no care for the original function of the creature’s limbs and organs. It’s common to see inverted creatures, their spines broken and bent, skittering crablike towards their prey. The limbs of others wither away, their ribcages blossoming out to form centipede-like legs that carry them forwards instead. A normal-looking deer might have, on closer inspection, no discernable mouth on its head; it’s only when it squats over food and disgorges its entire stomach from a ragged maw on its underbelly that it becomes apparent that something’s wrong. Some heartsblood creatures were never normal to start with. In the same way that the Heart is a collection of memories and fears made solid, these animals are flesh-echoes spun from the nightmares of the inhabitants. A bear has never made its way into the Heart, and yet there is one here – or a simulacrum of one, stitched together out of meat and dreams, a ragged imitation of a half-remembered glimpse. Folk stories persist of heartsblood creatures turning up to help injured travelers, especially if said travelers are favored of the Heart; these are mostly lies. There are two profiles here: one for smaller animals (dogs, cats, goats) and one for larger beasts (bears, deer, really big pigs).|None that they use themselves, but the townsfolk in the Heart will ascribe titles to particularly infamous beasts: Red-Tooth, Shadow, Fat Jack.||Shadow|Fat Jack.|10|2|Often: Meat and fur (D8); Rarely: Curious and unique bones (D10, Niche).|Massive claws, jagged teeth, suckered pseudopods (D8).||Wild, Warren.
HEARTSBLOOD BEAST|These were animals once, but the energies of the Heart and generations of breeding have changed them into something protean and terrible. The smallest are the size of mice (they can shift their bodies into insubstantial shadowstuff, making them nearly impossible to hunt), but those that will pose a threat to delvers tend to be the size of stray dogs, feral pigs, or scavenging foxes. The Heart has no care for the original function of the creature’s limbs and organs. It’s common to see inverted creatures, their spines broken and bent, skittering crablike towards their prey. The limbs of others wither away, their ribcages blossoming out to form centipede-like legs that carry them forwards instead. A normal-looking deer might have, on closer inspection, no discernable mouth on its head; it’s only when it squats over food and disgorges its entire stomach from a ragged maw on its underbelly that it becomes apparent that something’s wrong. Some heartsblood creatures were never normal to start with. In the same way that the Heart is a collection of memories and fears made solid, these animals are flesh-echoes spun from the nightmares of the inhabitants. A bear has never made its way into the Heart, and yet there is one here – or a simulacrum of one, stitched together out of meat and dreams, a ragged imitation of a half-remembered glimpse. Folk stories persist of heartsblood creatures turning up to help injured travelers, especially if said travelers are favored of the Heart; these are mostly lies. There are two profiles here: one for smaller animals (dogs, cats, goats) and one for larger beasts (bears, deer, really big pigs).|None that they use themselves, but the townsfolk in the Heart will ascribe titles to particularly infamous beasts: Red-Tooth, Shadow, Fat Jack.|A skeleton shifting uneasily in an ambulatory sack of flesh; A dog with shark- like rows of teeth that undulate and spasm; An emaciated pig on unstable legs of bone.|Mostly to survive and protect their young; but some have inscrutable motives implanted in their brains by the Heart, making them behave in unpredictablepatterns. HEARTSBLOOD BEAST:|Standard|5|0, usually; 1 if it’s particularly fierce.|Often: Meat and fur (D6); Rarely: Curious and unique bones (D10, Niche).|Teeth and claws (D6).||Wild, Warren
HEARTSEEDS|The Heart experiments. It has limitless power that some say even it doesn’t understand how to use. The shifting tunnels of the City Beneath and the malleable reality down there is one piece of evidence for this theory; another is heartseeds. These nodes of Heart energy are quietly birthed as wriggling, pallid maggots the size of a child’s forearm. They crawl from cracks in the earth, coalesce in forgotten cupboards and bury themselves secretly in the bodies of dead men. Once they feel like they’re in a good enough position, they will form a fleshy cocoon and pupate into something greater: a microcosm of the Heart itself, a testing ground designed to fail. As the cocoon swells and writhes, the area around the heartseed will begin to change. Walls twist and bend, water drips upward and animals crawl into ritual positions around it as they choke on their own liquefied organs. If undiscovered, the seed will grow and bloom intoaflowerofsorts.Bythispointtheareaaroundit will be behaving as if it were one tier deeper than it actually is, and reality will be coming apart at the seams. Gibberish words etch themselves into the|COMPANION. [Minor/Major,Echo] Seeing you as a fellow creature of the Heart,the beast comes to your aid. While this might be useful in the short-term (as it defends you from attackers, feeds you from its breast/regurgitates food into your mouth, leads you to safety, etc.) it will be a problem in the long term. Unless you or a friend kills it (and it will be very upset if you try), it will break into havens to kill people and pets,then bring you their mutilated corpses as gifts. walls; fields of broken glass hang in midair, glintinglikestars;fireburnscold,ornotatall;sound ispluckedfromthemouthsofspeakersandfunneled towardsthecentreofthespace. After a while, the flower will die. Someone will kill it in an attempt to normalise the surroundings or sell it to a collector,or it will be unable to sustain its pocket of unreality and wither away. But the Heart learns from it, if indeed it can be said to learn, and adapts its approaches to be more efficient next time. (Or perhaps more poetic? More terrifying? It is hard to understand what the Heart wants, or if it can want at all.) Heartseeds are akin to delvers in this respect: tendrils of something vast and other, exploring a strange environment and trying to bend it to their will. Approaching and handling a blossoming heartseed inflicts Echo stress – D8 on average, with more for those who try to pluck it out of the ground and transport it elsewhere. An intact and blooming heartseed is a D12 resource with the appropriate domain, and can be used to power rituals and blessings as though it had the Occult and Religion tags. A heartseed in its larval state is worth D10, because they often die during their metamorphosis if transported. APPEARANCE The appearance and effect of a heartseed depends on the domain it is pupating in: CURSED: A purple-black fleshy heart the size of a fist, strung up with sticky red cables of flesh and tendon, beating erratically. The Vermissian Sages say that you could pluck it out and, if you were quick enough, replace someone’s heart with it. This would be a terrible and very exciting way to die. DESOLATE: A patch of raw nothing sitting uneasily in a space where it simply cannot be – everything has to be something, and yet this exists (or, rather, doesn’t exist). It is best described as a sickening sensation that is felt in the stomach when observed; a void that doesn’t quite hurt your eyes to look at, but makes them feel strained, as though you’ve been crossing them. Desolate heartseeds attract the nihilistic worshippers of the Hungry Deep, who are eager to try and observe unalloyed nothingness. They will protect a nascent bloom with their lives. HAVEN: A drow child, huddled and shivering, at the centre of the chaos. They are rooted to the floor, and their palms are affixed to their clutched forearms with a thick, fibrous paste. They babble incoherently, recycling words they’veheardwhilstintheirlarvalstate.Theyare able to tell your name by looking directly into your eyes; this is the only real trick they know. OCCULT: A book or scroll with arcane-looking writing on it; a language you can half-read, or symbols that flit on the edge of your understanding. The pages are vellum-like and the words on them are, from a scholarly point of view, absolute bunkum. They hold no relevance to any ongoing esoteric theories, reference no known beings and don’t follow even the most basic ritual practice. But in the City Beneath, they work – to an extent. They use blood and bone magic akin to those practiced by the witches of Hallow, but they don’t require the user to be infected to cast them. RELIGION: An altar to no god in particular. Unlit candles give off a sickly, wan light regardless, and the images of saints and hallows seem to have been drawn by someone with only a passing understanding of humanoid anatomy. Close examination of the altar reveals it to be made of calcified bone and porous stone, and it’s covered in an astringent salt that inflicts wild hallucinations on anyone who gets it on their skin. TECHNOLOGY: A ticking, whirring clockwork device made from organic materials. Cogs are studded with teeth, belts wrought from loops of hair and skin,“glass” covers are transparent membranes.Though they look imperfect,each error and aberration is perfectly replicated, leading to a machine that is asymmetrical but staggeringly precise. WARREN: A carpet of slowly undulating and shifting mould that seeks out any biomass it can consume – fungus, primarily, but carrion and rotting plant matter are also good. At the centre of the slime colony is a writhing waist- high mass of yellow mould. It covers an area the size of a house in a thin layer of sticky acidic matter that eats away at everything it touches. Attempts to burn out the heartseed result in it panic-sporing,flooding the air with caustic cells in an attempt to escape. WILD: A plump lotus flower, writhing with energy, emitting waves of soporific musk. Animals will rush to feed on the nectar and pollinate it, which is inevitably fatal. The heartseed uses them as raw materials, controlling them with translucent feelers and rebuilding them into something new, which enjoys a brief and frantic life.|||||||||
MALE HARPY|Each male harpy is a magpie-like corvid about the size of a housecat, and they like to take sharp and shiny things from people. They tie the sharp things they take onto their beaks and talons to augment their dive-bombing method of catching prey. Older harpies have a wide array of knives, spear points, bayonets and cutlery attached to their pointed white beaks, and bent carpentry nails, fishing hooks and climbing pitons bound to their feet. One swooping from a cave roof can easily puncture the armour of an incautious delver. Harpies will gladly work in teams to dive-bomb a lone wanderer, quickly rendering them incapable of proper retaliation through pain and blood-loss. The shit-caked birds cackle and caw at their prey as it dies, and often imitate the sound of its death throes, as they are capable (and apparently cruel) mimics. They bring the shiny things back to their bowers: mating sites intended to attract the attention of a female. To a harpy, “shiny” seems to mean occult resonance – they have an instinctive attraction towards items that are used to augment magical spells. Necklaces bearing wicked sigils, black-wax candlesandtwo-headedgoatplacentahaveallbeen stolen from travellers and arranged around the harpy’s mating site in curious patterns. Once the harpy has gathered enough shiny things, it will kill smaller creatures – rats, mice, feral piglets, pitchkin – and drag their corpses back to its bower where it will mark summoning sigils in their blood on the stone floor. Then, working on instinct alone, the harpy will caw out a mating call using fragments of language that it does not understand, stolen from the throats of the dying. This draws the attention of a female. The female harpy is a different beast: a humanoid the height of a drow, with great wings where its hands would be, but no less filthy or callous than the male. The bowers act as summoning circles to draw them forth from whatever hellish dimensiontheydwellin.Theyemergethrougharift in the blood-soaked floor and mate with the male (an act which generally results in his death). Fromthere,theywillscreechforthandexperience the joys that the Heart has to offer: fresh prey, the terror on the faces of their victims, the feeling of flightaftereonsofconfinementintheirgrimdimension. They live on borrowed time, as the magic used to summon them is as bestial and instinctive as they are. Only more death and fear can keep them in the CityBeneath,orelsetheywillcrumbletodustastheir spiritsaredraggedbacktotheirotherworldlyprison. The female harpy will aim to slaughter her way to a haven, kill whoever she can inside and lay as many eggs as possible before her soul is claimed. In time, these grey-black orbs will hatch – always into a male – and they will start the cycle again.|Only those they’ve stolen from people who died nearby.|Imitating the voice of someone whowentmissingfromyourhaven;Tyingafishing hook onto its talons with surprising dexterity; Swooping towards you in a glinting blur.|To take sharp or shiny things; if people are carrying the things and won’t give themup,they’lltrytokillthepeoplebeforehand.|Risky if you attack them as they’re swooping from on high; if you can corner them, they’re Standard.|4|0|Scrap metal (D4, Haven), Occult gewgaws at their bower (D6, Occult).|Sharp things tied to their beaks and claws (D6; D6,Brutal when they’re swooping).||Wild, Desolate, Occult
MARKET SERF|In the twisting depths of the Red Market, gangs of followers devoted to their Incarnadine masters carve out territory with bludgeon, sword and shot. To these serfs, their master is a godlike figure; they were all riddled with debt, and the Incarnadine saved them and their family from ruin in exchange for service. There are many households living comfortably in the lower levels of the City Above thanks to the good work of the Incarnadines and the bloody empires of trade and murder protected by their loyal serfs.|Nux Ab-Crowfer, Quin Ex-Hypatia, Boswell Of-Tennant (Serfs take their master’s given name as their surname, usually with a prefix.)|Pushing jagged shards of coins into their gums to act as teeth; Bears records of their master’s financial transactions like a banner; Chants price lists like sacred mantras.|To bring heaping bounties to the feet of their splendid and gracious lords.|Standard|5|0, or 1 for favoured serfs|Often: A few bloodied nail-like coins (D4, Haven); Rarely: Something you could use as leverage against their master (D10, Religion).|Rusted, jagged blades (D6, Unreliable); one per group will carry either a blessed coin-firing blunderbuss (D6, Point-blank, Spread, One-shot) or a heavy club studded with sacred transactions (D8, Tiring).||Warren, Religion.
MIRROR SPIDERS|In the dim and distant past of the world, a god fled into the Heart, fatally wounded from a thousand cuts. Shattered and broken, it turned into a thousand spiders, each with a shard of mirror on its back in a unique shape. These spiders fled through the Heart to try to evade capture from the god’s enemies. It worked; the spiders were not found. Each is a godlinginitsownright,andeachcultivatesasectof zealously devoted spiders and other, lesser insects around itself. They know that they can eat each other to gain power, and thattheycannotdiefromoldage.The largest and most powerful mirror spider has eaten seventy or so of its kin, and is the size of a dinner plate. (It is in the possession of a High Matriarch of the Church of the Moon Beneath, who uses it to do her hair; the spider believes the relationship to be a sort of marriage.) Mirror spiders themselves aren’t much of a threat, unless they’re huge. The real danger comes from their suicide cults of mad insects ready to give their lives for the living god that walks among them. That, and the fact that should they gather together, they’ll become a full- scale god once more.|Each has a fragment of the true name of their original god; the sort of unwritable syllables that leave a bad taste in your mouth and smoke hanging in the air.|Residing in a tiny temple of discarded newspaper; Sitting beneath a miniature idealised portrait of themselves,created by their followers; Has stuck shards of mirror onto their back to look more impressive to other spiders.|To find and consume other mirror spiders.If you can find someone who can speak to them, they’re often willing to bargain.|Standard|6 per swarm – you can crush any individual member of it without bother.|4. Weapons that hit many insects at once (brooms, burning torches, etc) ignore this protection, but Piercing weapons don’t.|Each mirror spider is worth between a D6 and D12 resource, depending on the size and complexity of the mirror on their back.The miniature holy books and devotional art pieces are of interest to collectors (D8, Niche) but worthless otherwise.|Suicide Spiders that crawl into armour and down throats (D6, Piercing; each time it’s used, remove 1 resistance from the swarm).||Warren, Religion
PITCHKIN|These poor individuals were kicked out of the factories in the City Above because they were too ill to work. Spireblack, the flammable tar-like substance that collects in the eaves of factories, got into their lungs and ravaged their bodies with a black-vein sickness. They fled to the Heart and were warped by its energy until they formed a symbiotic relationship with the poison. Instead of killing them, it made them stronger (and took away their higher reasoning).|Each has a word marked on them which they now use as a name in their heavy, sussurating tongue: Vulpine, Wrath, Serrate, Quill.|Clinging to the underside of the ceiling with long black talons; Pausing to cough and retch up lumps of tar; Huge, jet- black eyes glinting in the darkness.|The pitchkin only want spireblack; they won’t bother you unless you threaten their supply. On occasion, traders carrying spireblack are attacked by bands of pitchkin.|Standard|7|0|Spireblack reserves (D8,Technology)|Filthy teeth and claws (D6)|Pitchkin are extremely flammable. Fire inflicts D8 damage minimum when used against them; however, once a pitchkin is on fire, its unarmed damage increases to D8. There is a martyr caste that sets themselves on fire to protect the stocks, but these are rare.|Technology, Cursed.
RED SAINT|These towering sentinels sit upon jagged thrones on the surface of the Red Moon and listen to the prayers of the faithful in their dreams. When roused from their slumber – usually by invasive delvers or rare incursions from rival heavens – they are terrifying to behold.|Saint Hellisent, Hallow Magdelene, Hallow Prothadeus.|Carrying their own skin to illustrate the way they were martyred; Wrenching huge and rusted greatswords out of the ground and discarding them when they break; Bearing two additional sets of arms that glitter with jewellery.|To be left alone that they might hear those who pray to them.|Standard, but see fallout below.|16|2|Burning Crown (D12)|Rusted blackiron blades (D8, Brutal, Tiring).sted blackiron blades (D8, Brutal, Tiring).|You can’t kill a Red Saint without access to forbidden Rituals of Extinguishing – something that the Church of the Moon Beneath might possess. The worst you can do without is incapacitate them, but their wounds heal in minutes.|Religion, Desolate.
SIGNAL-BOX CULTISTS|The Vermissian still has functioning signal-boxes: tiny rooms with mechanisms and lights that stutter into life, attempting to direct a train network that long ago slipped into a parasite dimension. Most of the information they give out is nonsense, and Vermissian Knights steer clear of them with a wariness that borders on superstition. But tunnel-dwellers – the luckless souls who make their homes in the infrastructure – view them as blind oracles that whisper secret truths to those brave enough to listen. The most devoted of these cults guard the signal- boxes, drape themselves in tattered raiments of the Vermissian (mouldering curtains from first-class carriages, rivets hammered into their bodies, implanted glass lenses over their eyes) and offer gibberish wisdom to vagrants in exchange for service or supplies.|Haslam, Levier, Forneau|Limbs reinforced with rusted pistons with weeping sores at the entry points; Chanting the names of Vermissian stations, some of which exist; Blind, carrying a legless cultist on their back who directs them|To induct others into the cult,to trade for supplies, ortoslitthethroatofaVermissian Knight and have them bleed out overthesignalmachinery.|Standard|4|0|AWAKE. [Minor, Blood/Fortune] The sounds of battle draw the half-asleep saint to full consciousness. Increase its difficulty to Risky and its resistance by 8.|Rustedbutstill- functional machinery(D8,Niche)|Levers, wrenches and bent rails (D6, Tiring); A fragment of the true nature of the Vermissian (D8, Ranged, One-Shot – inflicts Mind stress).|Technology, Warren. There are a wide variety of similar mystery cults in the Heart: The Followers of the Midden Mistress, The Wretched Galvanic, The Seers of the One Moon. Aside from their domain and descriptors, they function identically in mechanical terms.
