ANGEL|They are red and terrible and mighty. They bring with them waking dreams of chaos and unmaking, a screeching, scraping song of rust and ashes. The angels of the Heart, as they are known by the inhabitants of the place, are thankfully rare. When the cosmic intelligence at the center of the City Beneath needs something done quickly and without subtlety, it will create one and dispatch it with a specific mission: the destruction of a haven that’s encroaching on valuable resources, avenging the death of a beloved creature, reclaiming something that’s been taken, and so on. As they enter an area, it shifts into an unreal landscape. Walls pulse and seep interstitial fluid, the sound of grinding teeth drowns out all rational thought, and eyes blossom on every available surface.|Crimsonian, Vulperine, Theolosian (anyone who witnesses an angel knows its name instinctively; indeed,they are unable to forget it)|A noise like tearing meat and screaming gristle; Wet red streamers coalescing and spiralling into the shape of an elongated humanoid; An immobile statue of bone with floating masks that shimmer and reform as it speaks.|Each angel is created to fulfil a specific objective, and can’t understand things that aren’t its objective. Sometimes they can’t complete their mission and their programming breaks down, making them even more inscrutable.|Dangerous|20. Reducing an angel’s resistance to 0 will render them unable to move or act; as their flesh rapidly putrefies, it will be born again in some distant stone womb.|Equal to the tier on which they are encountered. PIERCING weapons will not overcome this.|Caul (D12, Occult; when worn, heartsblood creatures will treat you as kin)|Unmaking hands (Damage D10, Piercing)|The first time you see a particular angel, roll Endure+Cursed and mark D10 stress to Mind on a failure.|Cursed, Occult; but angels can be found in any domain if their mission takes them there, and few things can stop them.
AUTOMATON OF BURDEN|Though these mechanical creatures come in many varieties, the most common design is a headless four-legged pack animal. By using material scavenged from the broken alternate realities of the Vermissian (and from even weirder machines buried deeper beneath the earth), the creators of these devices can imbue them with basic intelligence via occult rituals. Some have the mind of a horse or ox bound into them, but such beasts are hard to come by in the Heart. Instead, the designers must rely on substitutes: the combined intelligences of twenty pigeons, perhaps, or one of the carrion-swine that plague the settlements of the City Beneath. These automatons follow their owners and carry their effects, so they’re popular with the reclaimers who dig into the depths of the Vermissian in search of treasure or sellable junk. Generally, you’ll see them attached to their master via a chain or rope, but some can detect sigils stamped into the ground: by carving a unique symbol into the base of their staff, a reclaimer can mark a path for their automaton as they walk along. Some older traders ride them, sitting cross-legged on their backs while surrounded by black candles, tapping ahead of the beast with a stick so it can follow the noise. Occasionally, automatons will wander away from their owner, or their owner will die, leaving them masterless. These are highly-prized treasures, and rumors of ramshackle constructs shuddering through the city laden with lost riches are popular in taverns and drug-dens all throughout the Heart.|Bessie, Vyssos 3-X, Wrench|Thrice-repaired, with legs of different lengths and wooden side-panelling; Housing a portable shrine to the Moon Beneath and trailing incense; Stolen and joy- ridden by wretched pitchkin.|To follow their master however they’ve been programmed to do so, and to avoid harm.|Standard|10|0, unless their owner has reinforced them to 1 or 2.|Frantic animal intelligence (D6, Occult); Spare parts (D8, Technology).|Spindly legs (Kill D4).|If you acquire an Automaton of Burden, it functions as a (Delve D6) item.|Technology
BLOODED|The Heart changes people mentally and physically. The blurring world in the City Beneath smears the bodies and souls of the inhabitants into curious patterns. Worming its way into their blood, it passes its influence on to their offspring, and children born several generations deep can be strange indeed. Some have developed new sense organs: black orb-like eyes that can sense the Heart’s touch, or bristling hairs that taste the wind pricking up from their forearms. Some are born with birthmarks that warp and change into script over the course of their lives; some have fingernails of organic glass or spiraling horns of bone curling from their brow. Stranger still, the Heart blurs the lines between flesh and not-flesh, between the individual and the place, and surgical implantation is possible in ways unthought of in the surface world. Body parts such as fingers, eyes, and occasionally whole limbs can be grafted onto a donor and retain function (the acceptance rate is surprisingly high). Animal body parts can be used too, and depending on the level of hearts-blood in the individual, even inorganic materials such as stone, repurposed machinery, or crystal can be worked into someone’s body and given sensitivity if not function. Those with implants who travel to the surface world find that their bodies start to reject them when free of the Heart’s influence. The deeper one travels into the Heart, the more blooded people one will find. Many of them regard delvers as invaders blundering into a world they’re not entitled to in order to plunder its secrets, and not without reason. It was those changed by the Heart who bore the brunt of the original expedition of the 33rd, the regiment that would become the Hounds.|Normal people names, perhaps about fifty years out of date: Versellian, Xandrix, Sewain, Brimner|Growing rows of teeth inside their mouth that make it difficult to speak; Listening to the singing crystals implanted in their chest and shoulders; Farming mushrooms and smoking clove cigarettes brought down by travellers.|To live in the Heart in peace, and not get killed thanks to some clueless delver unleashing hell.|Standard|6|0 for most, but those devoted to protecting the Heart and who are prepared for a fight have Protection 2|Jewellery, keepsakes and valuables (D6).Their bodies,or body parts,can be sold as medical curiosities, but most havens in the Heart frown on this.|Knife, club or poor-quality sword (D6); whatever ranged weapons they could scare up (D8, Ranged, One-Shot)|""|Wild, Cursed
BURNT-OUT OCCULTIST|The rush of power can leave you wanting more; sorcery can certainly be an easy route to getting what you want, but the bristling touch of other realities on the mind can intoxicate and bewitch the caster. Driven mad by want and out of other options,these desperate mages will form fractious gangs and rob or kill vulnerable travellers in search of scraps of magical power – or whatever resonance they can wring out of the poor individual’s blood. The real danger is that one of these wretches will get their hands on a serviceable book of demonology. They’re just smart enough to cast the spells and just tweaked-out enough to not take any of the proper precautions. More than one haven has been unmade in a scintillating blur when some reckless occultist created an incursion, willingly or not. The Hounds have a vested interest in stopping it from happening again.|Griz, Swent, Nox.|Wearing a cracked porcelain mask, the last vestige of their life of luxury in the City Above; Going through the bins outside a church looking for something with a vague hint of power; Trailing a Junk Mage, their hands outstretched, begging for angel feathers or automaton dreams.|To learn new spells; to gather occult resources and huff them to cast magic; to get high, and forget their troubles for a bit.|Standard|6|0|Almost-useless scraps of occult energy (D4, Occult)|Black market black magic (Kill D8,Brutal,Ranged.This can inflict Blood or Mind stress on the target; the GM chooses.)|If a Burnt-Out Occultist inflicts 7 or more stress on a single roll, they are taken out of action by the magical feedback.|Occult
BUTCHER|These were once desperate people who, despite the warning songs and folk tales, ate the forbidden flesh that grows in secret places, making wet pulsing walls and beckoning with lipless mouths. Over time, it turned them into horrendous creatures of blight and bone. They are easily twice the height of a person, with rangy,pallidlimbsthatgivethemtremendousspeed and strength. Each worships the cave that they eat from, and they are all hopelessly addicted to the heartsflesh. They drag back prey, or bits of prey, to pushintothewallandreplacewhattheyhaveeaten. Butchers are famously territorial, and will viciously kill one another on sight.|They don’t have names anymore; if they have to refer to each other, they do so in terms of their position, smell and deeds.|Bearing mighty antlers of rotting wood; Scratching symbols into the walls and trees with stones; Crouching on a rock and issuing forth a keening howl to others as a warning.|To claim meat (living, if possible) for its cave.|Risky|10|3|Butcher entrails (D6, prized for making warding sigils); Antlers (D6-D10, depending on the number of points); Victims’ leavings if you can find their cave and deal with the smell (D8).|Nightmare claws (D10)|""|Wild, Warren, Cursed
CARRION-PIG|Pigs eat whatever rubbish they can find, so they’re a common pest in havens; they’ll scrub through waste piles and gutters looking for delicious morsels until someone chases them away. But their appetite is nothing compared to the carrion- pig: an enormous beast, easily the size of a horse and hugely fat, that eats absolutely anything organic you throw near its mouth. Carrion-pigs are popular methods of waste disposal in the Heart. Catch one (if you’re brave enough), lock it in a cellar, throw anything vaguely edible down there, and it’ll gobble it up in seconds. Put a drain underneath and sluice it out once in a while, and you’ve got some foul-smelling fertilizer you can spread over whatever you’ve managed to grow. Is it cruel to do this? Absolutely. It’s a bastard thing to do, and in havens where they’re used, most inhabitants try not to think about it. What’s more, carrion-pigs’ size is only limited by their age and how much they get to eat, so those that have been kept for years (or even decades) slowly grow to fit the shape of wherever they’re imprisoned. But they never get sick (they’re medical marvels), can survive for months off their own reserves of fat, and are useful for disposing of bodies should the Hounds come round asking about what happened to the last bunch of delvers who came through the town and mysteriously disappeared. They grow their largest in captivity, but wild ones are still pretty huge – easily enough to threaten an unsuspecting delver should they come across one. The bigger problem is when mating season rolls around. Picking up the scent of huge and fecund females trapped underneath havens, males will gather on nearby outcroppings of rock and bellow a deep-throated call that makes windows shake. Should the female carrion-pig hear this, she’ll thrash around against the confines of her prison and – if it’s not well-built enough – destroy it, smash apart a good section of the haven with it, and romp off in search of her lover-to-be.|Owners tend not to name carrion-pigs because they don’t want to empathize with them.|Smashing through a nearby wall; Squealing so loud you think your eardrums are going to burst; Hungrily feasting on the corpse of their owner.|To eat, mate and, if it’s got time, gain revenge on its owners.|Risky, if they’re in heat; Standard otherwise.|15|5|Too much stinking pig fat (D8, Heavy).|Crushing body and champing jaws (Kill D8, Brutal).|""|Haven, Wild.
DRUID LEGBREAKER|The druid-gangs of Redcap Grove enforce their will over the surrounding area (and several neighbourhoods of Derelictus) with squads of shapeshifting druids. More than one headstrong tough has shot a rival on their turf only to have them, and all their mates, twist their bodies into nightmarish needle-toothed forms and attack.|Rhoz, Thorne, Pitch|Picking their teeth with a night- black thorn; Eyes that flick between different pupil types every time they blink; Smoking incense rolled into a cigarette.|To protect the interests of their High Druid masters.|Standard|8|1|Ritual gewgaws and tchotchkes made of mushrooms and animal bones (D6, Wild).|Sickles, picks and mushroom- hooks (Damage D6).||Wild.
FALSE HALLOW|Messiahs are a common sight in the Heart. Most weeks,some wide-eyed pilgrim will stumble out of Derelictus and into the winding tunnels of the City Beneath in search of the truth denied to them in the surface world. Shouting of a coming doom, or muttering madly to themselves about salvation, most of them die within a few weeks of entering the City Beneath. Most commonly they’ll be convinced they’re reincarnated Hallows (saints) of Our Glorious Lady or some other aspect of the moon, but martyrs for the Solar Pantheon or the Charnel Death-cult aren’t unheard of. But not all of them die. Some are charismatic, or brutal enough to be feared, and draw cults around themselves with petty trickery and promises of power in the afterlife. Some never believed in the first place, and are con-artists playing a dangerous game. With reality being what it is in the Heart, those skilled or lucky enough to gather a following can leech off the faith of those devoted to them, and begin to spontaneously generate powers that are indistinguishable from miracles. They can heal the sick, send poxes on their enemies and strike down the wicked with a single mighty blow. The Church of the Moon Beneath has a vested interest in removing False Hallows from power; they don’t like the competition, and a lot of the behaviour of these living bandit-saints could be construed as heretical. Similarly, temples from the City Above will dispatch agents to silence False Hallows before their schemes gain momentum. It took the efforts of a joint force of Solar Pantheon paladins and specially-warded delvers to locate and destroy the heretical Church of the New Sun in the year of Crimson Ravens.|Vasselin, Solipsus, Autumn-Storms-Curdle-the-Sky-and-We-Are-Found-Wanting.|Carried on a palanquin by four weeping devotees; Floating above the ground, their cloak caught in a wind that isn’t blowing; Casually walking through a hail of fire without a scratch.|To foster a cult around them and grow in power; this might be for pious or selfish reasons, but it’s hard to tell the difference.|Dangerous|8|3|Unhallowed relics (D10, Occult)|Simple work tools or repurposed ritual items (Kill D10 in their hands, Kill D6 for anyone else).|False Hallows will often be surrounded by a cult of some kind; use the Signal-Box Cultist to represent them, but exchange the Technology domain for Religion.|Religion, Occult
FEMALE HARPY|Each male harpy is a magpie-like corvid about the size of a housecat, and they like to take sharp and shiny things from people. They tie the sharp things they take onto their beaks and talons to augment their dive-bombing method of catching prey. Older harpies have a wide array of knives, spear points, bayonets and cutlery attached to their pointed white beaks, and bent carpentry nails, fishing hooks and climbing pitons bound to their feet. One swooping from a cave roof can easily puncture the armour of an incautious delver. Harpies will gladly work in teams to dive-bomb a lone wanderer, quickly rendering them incapable of proper retaliation through pain and blood-loss. The shit-caked birds cackle and caw at their prey as it dies, and often imitate the sound of its death throes, as they are capable (and apparently cruel) mimics. They bring the shiny things back to their bowers: mating sites intended to attract the attention of a female. To a harpy, “shiny” seems to mean occult resonance – they have an instinctive attraction towards items that are used to augment magical spells. Necklaces bearing wicked sigils, black-wax candles and two-headed goat placenta have all been stolen from travellers and arranged around the harpy’s mating site in curious patterns. Once the harpy has gathered enough shiny things, it will kill smaller creatures – rats, mice, feral piglets, pitchkin – and drag their corpses back to its bower where it will mark summoning sigils in their blood on the stone floor. Then, working on instinct alone, the harpy will caw out a mating call using fragments of language that it does not understand, stolen from the throats of the dying. This draws the attention of a female. The female harpy is a different beast: a humanoid the height of a drow, with great wings where its hands would be, but no less filthy or callous than the male. The bowers act as summoning circles to draw them forth from whatever hellish dimensiontheydwellin.Theyemergethrougharift in the blood-soaked floor and mate with the male (an act which generally results in his death). Fromthere,theywillscreechforthandexperience the joys that the Heart has to offer: fresh prey, the terror on the faces of their victims, the feeling of flightaftereonsofconfinementintheirgrimdimension. They live on borrowed time, as the magic used to summon them is as bestial and instinctive as they are. Only more death and fear can keep them in the CityBeneath,orelsetheywillcrumbletodustastheir spiritsaredraggedbacktotheirotherworldlyprison. The female harpy will aim to slaughter her way to a haven, kill whoever she can inside and lay as many eggs as possible before her soul is claimed. In time, these grey-black orbs will hatch – always into a male – and they will start the cycle again.|None that you would understand or be able to pronounce.|Wrenching the head off a struggling Hound; Cackling in four or five voices at once; Laying a clutch of eggs in the roof of an abandoned house.|To kill, taste blood and lay eggs in safe places where they can hatch.|Risky|13|1|If you kill it before it crumbles, a Harpy Heart (D10, Occult).|Hideous talons (D8, Brutal).|If the Harpy inflicts Minor Blood or Mind fallout, it restores D4 stamina; it restores D6 if it inflicts Major or Critical fallout.|Wild, Desolate
FERAL PSYCHOPOMP|The gaps between worlds are thin in the Heart, and it is possible to break into (or out of) heaven and hell using rituals performed at specific sites. Were everything working as intended, these realms would be entirely separate from the City Beneath – but the energy of the Heart has burrowed into other dimensions and they have begun to leak through, as have the beings who live within them. Many faiths tell of creatures, collectively known as psychopomps, who ferry the souls of the dead to the afterlife. Curious or opportunistic psychopomps will sometimes leave their respective afterlives and explore the curious terrain of the Heart. Severed from the divine intelligences that govern them, these creatures turn animalistic and desperate when trapped in the wrong reality. Falling back on instinct, they attempt to do what they’ve done for eternity: ferry people to the underworld, even if some of those people aren’t yet dead. There are angels, their ivory-white robes ripped andstained, that cluster in therafters of the Church of the Dark Mother and howl profanities at anyone who comes near. In the depths of the Lost Sepulchre, dead-eyed warrior maidens in rusted armour stagger blindly in search of souls worthy enough to carry to heaven on their long-dead winged steed. And in Cloven, the wild-children capture the mad, blind celestial horses that rampage through the overgrown streets and pluck their tattered wings to sell their feathers to occultists.|Very few of them remember their names; some have adopted names that they have overheard whilst hiding in the City Beneath.|Clutching a rusted celestial spear to their chest; Patching up tattered wings with birdshit and feathers; Eating the pages of a holy book, one by one.|To guide souls back to their respective underworlds, but the doorways are lost and the “souls” are whoever they find trespassing on their domains.|Standard|7|2|Tattered raiments (D6, Religion, Occult).|Broken celestial blades (Kill D6, Brutal).||Religion, Desolate.
FLIGHTLESS OWL HIVE|There’s a folk story about how Owl, in his hubris, tried to court the Moon Goddess back when Spire was young. He claimed that he was king of the skies and that she should be honoured to be his bride.She cursedhimandallhischildrentoneverflyagain, and only thesmallowlswereabletosneakawayfromher notice;even now, owls on the surface world will never land in a patch of moonlight. The larger owls were so ashamed that they learned the trick of burrowing so they could live beneath the earth and never have to set eyes on the moon ever again. That’s the story, anyway. The reality is that the Heart supports several hundred colonies of invasive, flightless owls. They operate in a hive structure like bees or ants,bringing back kills and regurgitating them into the mouths of scores of mewling, blind young. They’re larger than surface owls and more vicious: they work in packs to bring down a target many times their size,screeching and flapping dust into the air to confuse their prey. They’ll often set up shop beneath a settlement and start stealing food, then animals, then children and so on. It’s a fairly common first job for delvers to descend into the cramped tunnels beneath a haven and cull an owl hive;.Some superstitious types believe that a feather or bone from thefirstowltheyeverkillisagoodluckcharm,and even seasoned explorers will bear a dirty-white feather in their cap as a memento. It’s an easy enough job if you take out each group of guard owls quickly. Just don’t let them wake the hive; if they do,the guttural song of the queen will echo through the chambers,and the invaders should leave quickly unless they wish to be torn to pieces.|The individual owls don’t have names; each Queen’s name is a minute-long screech and only pronounceable by other owls.|Eating a weaker member of the hivewhole; Blind and operating by echo location; Mangy,with yellowing skin and patchy feathers.|To defend the Queen and ensure the safety of the hive.|Standard.|3|0|Assorted owl bones (D4, Occult)|Beaks and claws (D6)||Wild, but those owls aren’t the problem; they can be found in the Warren,Desolate and Haven domains too, which is when they come into conflict with people.
GHOST|Ghosts are a fact of life in the Heart. Between the weird energies flowing through the place and the capacity for sudden violent death,the odds of your spirit rising as a ghost after your death are pretty high. Most of the burial rites of the inhabitants focus around stopping this from happening. Ghosts (or phantoms, spectres or wraiths – there are a lot of names for them) tend to haunt something that was important to them in life. Most commonly they’ll take up residence in the building where they lived and try to drive out new tenants; other times, they’ll haunt an item that they owned, the weapon that killed them, their murderer or lover and so on. Not every ghost is malevolent, but many are; and most of those that aren’t are far removed from reality, thanks to their minds fracturing under the stress of death. You can put a ghost to rest by “solving” whatever unfinished business it has in the City Beneath or consecrating its remains, which allows it passage to its chosen afterlife. But not every ghost wants to move on. Some are actively fleeing judgement and making the most of their time trapped between worlds.|Old-fashioned names like Enriette, Gregorious, Burrage.|Trailing ectoplasm from fatal wounds; Appearing only in mirrors and reflections; Manifesting as a flash of cold and the sound of creaking ice.|It differs from ghost to ghost, but most are caught between abject loneliness and directionless rage.|If you can see them properly, Standard; otherwise, Risky. A character who can see can aid another who can’t.|5|10 (Not ignored by Piercing, see below).|Nothing of import.|Spectral claw (D6, Piercing); Otherworldly phenomena (D6, Spread, One- Shot).|Consuming an appropriate resource with the OCCULT or RELIGION tags and a value of D6 or greater allows a character to ignore the ghosts’ protection value until the end of the situation (e.g. anointing your hammer with holy water, wrapping prayer flags around your fists, scattering sacred salt). Researching the specific item needed to affect a specific ghost allows the character to ignore the ghosts’ protection value and increases their stress inflicted by two steps (e.g. etching the ghost’s suicide note into your sword, wrapping their late husband’s hair around your wrists, trapping them in a room by pouring dirt from their grave into the keyholes).|Cursed, Occult, Religion.
